{
  "cost_usd": 0.0,
  "counts": {
    "critical": 0,
    "high": 1,
    "info": 0,
    "low": 0,
    "medium": 0,
    "total": 1
  },
  "duration_ms": 25,
  "exit_code": 0,
  "gate": {
    "fail_on": "none",
    "failed": false
  },
  "generated_at": "2026-08-25T00:00:00Z",
  "outputs": {
    "findings.json": {
      "bytes": 843,
      "path": "findings.json",
      "sha256": "e5f036b9d118c25fc6de14ba9fbf4202d66749f20eb0e24acf1302c71a618dd9"
    }
  },
  "run_id": "1a57e554-0cd6-5a7c-88e2-9152b25cd0f8",
  "schema_version": 1,
  "status": "completed",
  "stopped": null,
  "subject": {
    "base_sha": null,
    "content_digest": null,
    "dirty": false,
    "head_sha": "0123456789abcdef0123456789abcdef01234567",
    "kind": "git",
    "root": "/workspace/project"
  },
  "tool": "security-ai-scanner",
  "total_tokens": 100,
  "version": "0.3.0-dev"
}
